{
  "cutoff_date": "2026-08-02",
  "eligible_count": 1,
  "eligible_records": [
    {
      "candidate_id": "delta-fund-wayfinder-ventures",
      "canonical_name": "Wayfinder Ventures",
      "decision": "eligible",
      "decision_evidence_ids": [
        "evidence-delta-wayfinder-independent-activity",
        "evidence-delta-wayfinder-independent-portfolio"
      ],
      "review_record_id": "review:review-2:delta-fund-wayfinder-ventures",
      "validation_partition": 1
    }
  ],
  "frozen_on": "2026-08-02",
  "review_records_sha256": "6cebb5fa7b369631015014a1474fe5338ecb9264c630b58d07fcdbfa0613ba49",
  "schema_version": "1.0",
  "source_decisions_sha256": "ea640962a9cf564d29f01a31c930fffa7afc71a3013ce0f91c787767d89c2ac0",
  "status": "frozen"
}
